{
    "siteType": "SHOP",
    "title": "some-title",
    "title-lead": "Lorem ipsum dolor sit amet, consectetur adipiscing elit, sed do eiusmod tempor incididunt ut labore et dolore magna aliqua.",
    "title-sublead": "Sed ut perspiciatis unde omnis iste natus error sit voluptatem accusantium doloremque laudantium, totam rem aperiam",
    "title-logo": "https://raw.githubusercontent.com/darkowlzz/netlify-test/data/static/face.png",
    "primary-background": "black",
    "secondary-background": "#f2f5f7",
    "info": [],
    "catalog": [
        {
            "id": "1",
            "category": "example",
            "items": []
        }
    ]
}
